{"description": "Walking / high ego-motion logistics: motion-adaptive sampling, pixel motion features primary.", "evidence": {"mosaic": true, "required_fields": ["profile", "router_margin", "descriptors_sha", "motion_flag"]}, "features": {"set": "pixel26", "work_res": [160, 90]}, "model": {"head": "logistic_C0.01_balanced", "per_regime_threshold": true, "weights": "models/pixel26_motion_calibrated.json"}, "name": "walking_logistics", "sampling": {"early_exit_s": 4, "fps": 10, "probe_every_k_windows": 1, "temporal_policy": "motion_adaptive", "window_s": 10}, "thresholds": {"accept": 0.62, "reject": 0.38}, "version": "0.1.0"}
