{"description": "Native 1080p/30fps factory footage (Egocentric-10K-like): downsampled descriptors, sparse probe, wide abstain until transfer is proven.", "evidence": {"mosaic": true, "required_fields": ["profile", "router_margin", "descriptors_sha", "unseen_regime_flag"]}, "features": {"set": "both", "work_res": [160, 90]}, "model": {"head": "logistic_C0.01_balanced", "per_regime_threshold": false, "weights": "models/ensemble_two_view.json"}, "name": "factory_1080p30", "sampling": {"early_exit_s": null, "fps": 5, "probe_every_k_windows": 2, "temporal_policy": "sparse_probe", "window_s": 10}, "thresholds": {"accept": 0.75, "reject": 0.25}, "version": "0.1.0"}
