{"description": "Blurry and/or low-light windows: trust embeddings over pixel texture, widen abstain band, never early-exit.", "evidence": {"mosaic": true, "required_fields": ["profile", "router_margin", "descriptors_sha", "lowlight_flag"]}, "features": {"set": "eg2", "work_res": [160, 90]}, "model": {"head": "logistic_C0.01_balanced", "per_regime_threshold": true, "weights": "models/eg2_blur_calibrated.json"}, "name": "blurry_lowlight", "sampling": {"early_exit_s": null, "fps": 5, "probe_every_k_windows": 1, "temporal_policy": "full", "window_s": 10}, "thresholds": {"accept": 0.68, "reject": 0.32}, "version": "0.1.0"}
