{"description": "Sharp, well-lit, mostly stationary bench work (IndEgo-like: 480p/10fps). Full evidence, tight abstain band.", "evidence": {"mosaic": true, "required_fields": ["profile", "router_margin", "descriptors_sha"]}, "features": {"set": "both", "work_res": [160, 90]}, "model": {"head": "logistic_C0.01_balanced", "per_regime_threshold": false, "weights": "models/ensemble_two_view.json"}, "name": "clear_stationary", "sampling": {"early_exit_s": 6, "fps": 10, "probe_every_k_windows": 1, "temporal_policy": "full", "window_s": 10}, "thresholds": {"accept": 0.6, "reject": 0.4}, "version": "0.1.0"}
